{
  "$schema": "./repos.schema.json",
  "schemaVersion": "1.3.0",
  "organization": "OpenLyceum",
  "displayName": "Open Lyceum",
  "pagesBase": "https://openlyceum.github.io",
  "repos": [
    {
      "name": ".github",
      "displayName": "Open Lyceum .github",
      "type": "config",
      "isSimulation": false,
      "lineage": null,
      "upstream": null,
      "language": [
        "Markdown"
      ],
      "framework": null,
      "description": "Organization-level community health defaults (license, contributing, code of conduct, security, issue/PR templates) and shared AI-assistant guidance.",
      "deployedUrl": null,
      "physicsTopics": [],
      "screens": null,
      "status": "active"
    },
    {
      "name": "ACPhasor",
      "displayName": "AC Phasor",
      "type": "simulation",
      "isSimulation": true,
      "lineage": "original",
      "upstream": null,
      "language": [
        "TypeScript"
      ],
      "framework": "SceneryStack",
      "description": "AC phasor simulation exploring resistors, inductors, and capacitors across four screens — Intro (single element), Series RLC, Resonance, and Power.",
      "physicsTopics": [
        "AC circuits",
        "phasors",
        "RLC",
        "impedance",
        "resonance"
      ],
      "screens": [
        {
          "id": "intro",
          "title": "Intro"
        },
        {
          "id": "series-rlc",
          "title": "Series RLC"
        },
        {
          "id": "resonance",
          "title": "Resonance"
        },
        {
          "id": "power",
          "title": "Power"
        }
      ],
      "status": "active"
    },
    {
      "name": "Almanach",
      "displayName": "Almanach",
      "type": "tool",
      "isSimulation": false,
      "lineage": null,
      "upstream": null,
      "language": [
        "TypeScript",
        "Markdown"
      ],
      "framework": "VitePress",
      "description": "A file-based SceneryStack knowledge base with API guides, software patterns, styling, and accessibility conventions, designed for humans and LLM agents alike.",
      "physicsTopics": [],
      "screens": null,
      "status": "active"
    },
    {
      "name": "Baseline",
      "displayName": "Baseline",
      "type": "tool",
      "isSimulation": false,
      "lineage": null,
      "upstream": null,
      "language": [
        "Shell",
        "JSON",
        "Markdown"
      ],
      "framework": null,
      "description": "Immutable upstream baselines / ground truth for Open Lyceum sims: pinned git clones (via fetch-baselines.sh) and committed non-git snapshots (NAAP dumps, SPINS, etc.).",
      "deployedUrl": null,
      "physicsTopics": [],
      "screens": null,
      "status": "active"
    },
    {
      "name": "BasicCoordinatesAndSeasons",
      "displayName": "Basic Coordinates and Seasons",
      "type": "simulation",
      "isSimulation": true,
      "lineage": "naap",
      "upstream": {
        "org": "naap",
        "name": "Basic Coordinates and Seasons",
        "url": "https://astro.unl.edu/naap/motion1/motion1.html"
      },
      "language": [
        "TypeScript"
      ],
      "framework": "SceneryStack",
      "description": "SceneryStack port of the NAAP 'Basic Coordinates and Seasons' lab. Explore terrestrial and celestial coordinates and how Earth's axial tilt produces the seasons across three screens.",
      "physicsTopics": [
        "astronomy",
        "coordinates",
        "seasons",
        "celestial sphere",
        "latitude",
        "longitude"
      ],
      "screens": [
        {
          "id": "terrestrial",
          "title": "Terrestrial Coordinates"
        },
        {
          "id": "celestial",
          "title": "Celestial Coordinates"
        },
        {
          "id": "seasons",
          "title": "Seasons"
        }
      ],
      "status": "active"
    },
    {
      "name": "Baton",
      "displayName": "Baton",
      "type": "tool",
      "isSimulation": false,
      "lineage": null,
      "upstream": null,
      "language": [
        "Shell",
        "YAML"
      ],
      "framework": null,
      "description": "Org orchestration: reusable CI/CD workflows, cross-repo automation scripts, Dependabot templates, the repository catalog, and the simulation landing page.",
      "physicsTopics": [],
      "screens": null,
      "status": "active"
    },
    {
      "name": "CarnotHeatEngine",
      "displayName": "Carnot Heat Engine",
      "type": "simulation",
      "isSimulation": true,
      "lineage": "original",
      "upstream": null,
      "language": [
        "TypeScript"
      ],
      "framework": "SceneryStack",
      "description": "Explore the Carnot cycle across three screens: a piston-cylinder tied to a live PV diagram, a quantitative efficiency lab with a T–S view, and the same cycle reversed as a refrigerator or heat pump.",
      "physicsTopics": [
        "thermodynamics",
        "Carnot cycle",
        "heat engines",
        "efficiency",
        "entropy",
        "refrigeration"
      ],
      "screens": [
        {
          "id": "intro",
          "title": "Intro"
        },
        {
          "id": "efficiency-lab",
          "title": "Efficiency Lab"
        },
        {
          "id": "reversed-cycle",
          "title": "Reversed Cycle"
        }
      ],
      "status": "active"
    },
    {
      "name": "CrystalLattice",
      "displayName": "Crystal Lattice",
      "type": "simulation",
      "isSimulation": true,
      "lineage": "original",
      "upstream": null,
      "language": [
        "TypeScript"
      ],
      "framework": "SceneryStack",
      "description": "Explore crystal structure across five screens: the five 2D Bravais lattices, cubic unit cells and packing factors, hexagonal vs cubic close packing, Miller indices, and aperiodic order — Penrose tilings and the hat monotile, with diffraction as sharp as a crystal's but a symmetry no crystal can have.",
      "physicsTopics": [
        "crystallography",
        "Bravais lattices",
        "unit cells",
        "close packing",
        "Miller indices",
        "diffraction",
        "quasicrystals",
        "aperiodic tilings"
      ],
      "screens": [
        {
          "id": "lattices-2d",
          "title": "2D Lattices"
        },
        {
          "id": "cubic-systems",
          "title": "Cubic Systems"
        },
        {
          "id": "close-packing",
          "title": "Close-Packing"
        },
        {
          "id": "miller-indices",
          "title": "Miller Indices"
        },
        {
          "id": "aperiodic-order",
          "title": "Aperiodic Order"
        }
      ],
      "status": "active"
    },
    {
      "name": "DopplerEffect",
      "displayName": "Doppler Effect",
      "type": "simulation",
      "isSimulation": true,
      "lineage": "original",
      "upstream": null,
      "language": [
        "TypeScript"
      ],
      "framework": "SceneryStack",
      "description": "Interactive simulation of the Doppler Effect — visualizes how the frequency of sound waves shifts with relative motion between source and observer.",
      "physicsTopics": [
        "waves",
        "sound",
        "frequency",
        "motion"
      ],
      "githubTopics": [
        "doppler"
      ],
      "screens": [
        {
          "id": "doppler-effect",
          "title": "Doppler Effect"
        }
      ],
      "status": "active"
    },
    {
      "name": "ElectricFieldOfDreams",
      "displayName": "Electric Field of Dreams",
      "type": "simulation",
      "isSimulation": true,
      "lineage": "phet",
      "upstream": {
        "org": "phet",
        "name": "Electric Field of Dreams",
        "url": "https://phet.colorado.edu/en/simulation/efield"
      },
      "language": [
        "TypeScript"
      ],
      "framework": "SceneryStack",
      "description": "SceneryStack port of the PhET 'Electric Field of Dreams' simulation. Place charged particles and observe Coulomb interactions and an adjustable uniform external field.",
      "physicsTopics": [
        "electrostatics",
        "electric fields",
        "Coulomb's law"
      ],
      "githubTopics": [
        "electric-field",
        "electromagnetism"
      ],
      "screens": [
        {
          "id": "electric-field-of-dreams",
          "title": "Electric Field of Dreams"
        }
      ],
      "status": "active"
    },
    {
      "name": "ExtrasolarPlanets",
      "displayName": "Extrasolar Planets",
      "type": "simulation",
      "isSimulation": true,
      "lineage": "naap",
      "upstream": {
        "org": "naap",
        "name": "Extrasolar Planets",
        "url": "https://astro.unl.edu/naap/esp/esp.html"
      },
      "language": [
        "TypeScript"
      ],
      "framework": "SceneryStack",
      "description": "Interactive simulation of two exoplanet-detection methods — radial velocity (Doppler wobble) and transit (light-curve dip).",
      "physicsTopics": [
        "astronomy",
        "exoplanets",
        "radial velocity",
        "transit photometry",
        "orbits"
      ],
      "screens": [
        {
          "id": "radial-velocity",
          "title": "Radial Velocity"
        },
        {
          "id": "transit",
          "title": "Transit"
        }
      ],
      "status": "active"
    },
    {
      "name": "FieldBoundary",
      "displayName": "Field Boundary",
      "type": "simulation",
      "isSimulation": true,
      "lineage": "original",
      "upstream": null,
      "language": [
        "TypeScript"
      ],
      "framework": "SceneryStack",
      "description": "Explore Maxwell boundary conditions for E/D and B/H at a planar interface between two media.",
      "physicsTopics": [
        "electromagnetism",
        "boundary-conditions",
        "dielectrics"
      ],
      "screens": [
        {
          "id": "electric",
          "title": "Electric"
        },
        {